{
  "eventId": "live-run-007-e3",
  "runId": "live-run-007",
  "seq": 3,
  "occurredAt": "2026-09-21T12:00:00Z",
  "type": "session.replaced",
  "payload": {
    "previousSessionId": "sess-a",
    "reason": "restoreSession called with a different reference"
  },
  "evidence": [
    {
      "source": "pi-runtime",
      "refId": "evt-seq-3"
    }
  ]
}
